Food_ID,Name,Calories,Food_Type,Meal_Time,Veg_Non,Describe
117,chicken in mahalak sauce,380,Indian,Dinner,non-veg,"Salt, sugar, seasonings, oil, corn flour, chicken leg, fresh chilli, garlic, ginger, onion, red chili paste, tomato catchup, paprika, yellow capsicum, vegetable stock"
118,grilled kasundi honey chicken with sweet potato mash,360,Indian,Dinner,non-veg,"Chicken breast, kasundi (Bengali mustard sauce), sweet potato, red and yellow capsicum, broccoli, garlic buds, refined oil, salt, butter, cream, green onion, honey, ginger and garlic paste"
119,chicken dong style,340,Chinese,Dinner,non-veg,"Oil, chicken breast, garlic, ginger, tomato catchup, oyster sauce, shitake mushrooms, bomb shoots (boiled), salt, sugar, broth powder, shocking wine, potato starch, sesame oil, green onions"
120,microwave tandoori chicken,450,Indian,Dinner,non-veg,"Chicken (sliced), garlic paste, ginger paste, Hung curd, salt, garam masala, coriander powder, pepper powder, cream, oil, for garnishing:, lemon pieces, onion rings"
121,methi malai cranberry chicken,380,Indian,Dinner,non-veg,"Chicken (sliced ??into large pieces), salt, cranberry puree, red chilli powder, garam masala, coriander powder, cumin powder, chaat masala, corn flour, fenugreek leaves, gram flour, ginger, garlic, cream, Greek yogurt, butter"
122,southern fried chicken tenders,420,Snack,Snack,non-veg,"Chicken breast (cut 20 strips, 20 grams), all purpose flour, salt, hot red chillies, eggs, bread crumbles, white cabbage slaw, pasarley sprig, honey-mustard dip, green bell pepper"
123,thai style chicken tikka,370,Thai,Snack,non-veg,"Chicken Thais, Thai Ginger, Lemon Leaves, Lemongrass, Coconut Milk Powder, Refined Oil, Red Curry Paste, Peanut Butter, Bezel Leaves, Lotus Stem, Yellow Butter, Chaat Masala"
124,chicken gilafi kebab,410,Indian,Snack,non-veg,"Chicken Mince, Onion, Tomato, Green Capsicum, Green Coriander, Green Chilli, Salt, Oil, Cashew, Almond, Mint, Red Chilli Powder, Ginger Garlic Paste, Cumin Powder, Lemon Juice, Fresh Cream, Kewda Water"
125,cheese chicken kebabs,370,Indian,Snack,non-veg,"Chicken Thais, Garlic Paste, Garlic Paste, Yellow Chilli Powder, Cheese, Curd, Gram Flour, Green Cardamom Powder, Yellow Chilli Powder, Mace Powder, Nutmeg Powder, Rock Salt, Green Coriander, Oil"
126,andhra crab meat masala,320,Indian,Dinner,non-veg,"processed crab meat, refined oil, curry leaves, garlic, green chilli, onion, ginger-garlic paste, coriander, coriander powder, cumin powder, turmeric powder, garam masala powder, kashmiri chilli powder, salt, lemon, chop masala, tomato"
127,cajun spiced turkey wrapped with bacon,490,Mexican,Dinner,non-veg,"turkey breast, cajun spice, spinach leaves (cooked and drained), garlic pods, salted butter, feta cheese, bacon strips, ground black pepper, for cajun spice:, onion powder, garlic powder, seasoning salt, paprika, ground black pepper, cayenne pepper, oregano, thyme, red pepper flakes (if you like it spicy))"
128,thai lamb balls,360,Thai,Dinner,non-veg,"lamb (minced), couscous, scallion, garlic, egg, parsley, olive oil, mint, ao nori herb, salt, five spice, cinnamon powder"
129,oyster lamb,380,Thai,Dinner,non-veg,"vegetable oil, garlic, ginger, lamb, stock, oyster sauce, dry sherry, sugar, celery, salt, bokchoy, shitake mushroom"
130,chicken shami kebab,290,Indian,Dinner,non-veg,"oil, cumin seeds, cloves, black peppercorns, cinnamon, coriander seeds, ajwain, red chilli whole, chilli flakes, boneless chicken, salt, water, ginger, green chilli, garlic, coriander leaves , mint leaves , egg"
131,balti meat,430,Mexican,Dinner,non-veg,"refined oil, black cardamoms, green cardamoms, mace, clove, cinnamon stick, black pepper corn, ginger garlic paste, ginger, green chilies, mutton curry cut, brown onion paste, salt, kashmiri red chili powder, tomato puree, garam masala powder, coriander powder, cumin powder"
132,coffee marinated mutton chops,400,Thai,Dinner,non-veg,"mutton chops, espresso, honey, balsamic vinegar, rosemary, pink peppercorns (crushed), olive oil, salt"
133,sali boti (parsi meat dish),360,Indian,Dinner,non-veg,"mutton (wash and cut into very small cubes), ghee or oil, tomatoes, onions, green chillies, coriander leaves, chilli powder, turmeric powder, ginger-garlic paste, water, vinegar, jaggery, salt, potatoes, oil"
134,braised lamb shanks,410,Thai,Dinner,non-veg,"Lang Shanks, Olive Oil, Onion, Carrots, Celery Stick, Garlic, White Wine, Lamb Stock, White Wine, Rosemary, Tomata Puree"
135,bengali lamb curry,380,Indian,Dinner,non-veg,"Lamb pieces, yogurt, turmeric powder, castor sugar, red chili powder, mustard oil, onion, ginger paste, garlic paste, green chillies, mustard seeds, almonds"
136,malabari fish curry,420,Indian,Dinner,non-veg,"sear fish, coconut, ginger, pureed tamarind, salt, powdered turmeric, green chillies, red chilli powder, shallots"
137,japanese fish stew,380,Japanese,Dinner,non-veg,"sole fillet (you can also do 2/3 types of fish), large shrimps (optional), potatoes (peeled), onions (cut into slices), garlic cloves, red capsicum (can use green also), parsley or coriander (choose the herb that most suits your taste buds), few dashes of hot sauce, paprika, olive oil, white wine, rock salt"
138,malabar fish curry,410,Indian,Dinner,non-veg,"whole coriander seeds, whole red chilli, coconut oil, mustard seeds, onion, curry leaf, coconut milk, tamarind pulp, coriander, seabass fish curry cuts"
139,surmai curry with lobster butter rice,450,Thai,Dinner,non-veg,"tamarind, red chilli powder, turmeric powder, salt, fresh coconut, onion, garlic cloves, coriander seeds, fenugreek seeds, red chilli powder, turmeric powder, tamarind (lemon sized), butter, lobster (de-shell and devein and make a small cube), salt and lime, surmai"
140,seared salmon in tabasco butter,380,Thai,Dinner,non-veg,"butter, tabasco, chives, salt, salmon fillet, olive oil, sea salt"
141,"risotto lobster with parmesan egg pancake, confit tomatoes and coral tuille",600,Italian,Dinner,non-veg,"lobster shell, carrot, leeks, garlic cloves, tomato paste, bay leaf, peppercorn, water, lobster meat, arborio rice, onion, leeks, lobster stock, parmesan cheese, cream, salt, olive oil, egg, parmesan, flour, milk, parsley, salt, cherry tomatoes, garlic pods, olive oil, water, oil, flour, salt"
142,fish skewers with coriander and red wine vinegar dressing,320,Thai,Dinner,non-veg,"sea bass fillets, olive oil (for grilling), red wine vinegar, sugar, extra virgin olive oil, garlic clove, coriander, bamboo skewers"
143,seafood rock filler,500,French,Dinner,veg,"baked tart of mixed sea food served with phyllo fruit bowl, savory tart shell (semi baked), mixed sea food, mornay sauce, assorted herb and seasoning, phyllo pastry, assorted seasonal fruit"
144,shrimp & cilantro ceviche,280,French,Dinner,veg,"prawns, gherkin, onion, cilantro, mix bell pepper, tiger milk, sweet corn, sea salt, black pepper, green lemon juice, cherry tomato, edible flower, coriander stems, celery stalks, garlic, ginger, red onion, lemon juice, sea salt, black pepper"
145,saewoo bokumbop (shrimp fried rice),420,Japanese,Dinner,veg,"cooked rice, shrimp (de-veined, onion, cooked green peas, green onion, egg (scrambled), vegetable oil/butter, soy sauce, sesame oil, salt, pepper"
146,thai prawn curry & baked rice ,380,Thai,dinner,veg,"jeera whole, coriander seeds, kashmiri chilly, garlic, ginger, green chillies, kokum, coconut, onion, tomatoes, coriander, prawns, salt, turmeric powder, garlic paste, asafoetida, refined oil, ginger paste, goan rice, coconut milk, green chillies, fresh coconut, hing, refined oil, coriander leaves, basmati rice, coconut milk, green chillies, coconut milk, coconut, salt, green chillies, curry leaf, lecite"
147,bihari fish curry,350,Indian,dinner,non-veg,"rohu fish, salt, turmeric powder, chilli powder, oil, garlic , green chillies, mustard seeds, black peppercorns, cumin seeds, whole red chillies, fenugreek seeds, tomatoes, mustard oil, bay leaves, water, garam masala, coriander leaves"
148,curry fish fingers,300,Thai,dinner,non-veg,"river sole fish (cut in thin strips), garlic paste, salt , lime juice, beer, flour, cornflour, white pepper, eggs, mustard"
149,prawn and litchi salad,200,Healthy Food,snack,veg,"prawns (shelled and cleaned), spring onions, mango flesh, litchis (deseeded), chilli flakes, lemon (for lemon juice), olive oil, peanuts (to garnish), salt"
150,kerala fish curry,420,Indian,dinner,non-veg,"white fish (cut into cubes), onion, tomato, garlic cloves, fresh green chillies (deseeded), oil, fresh coconut paste, red chilli paste, coriander powder, turmeric powder, salt, whole dry red chillies, black mustard seeds, curry leaves, tamarind extract, water"
151,fish andlouse,550,French,dinner,non-veg,"white wine and water mix to cover, onion, salt, bay leaf, black pepper corns, olive oil, onion, garlic, tomatoes (peeled and seeded), basil leaves, spring fresh thyme - optional 1 bay leaf, salt and pepper, olive oil, wine vinegar, prepared mustard, salt and pepper, assorted garden herbs ( parsley, basil etc."
152,prawn fried rice,380,Thai,lunch,veg,"Oil, Bacon, Prawns, Chicken, Carrots, Garlic Buds, Ginger, Spring Onion, Sweet Chili Sauce, Soy Sauce, Salt, Pepper, Sweet Corn, Vinegar, Baked Rice, Green Coriander"
153,damdama fish curry,350,Indian,dinner,non-veg,"Fish, onion, tomato, reshagi red chilli powder, cumin powder, coriander powder, coriander, cumin, salt, oil"
154,fish with white sauce,320,Italian,dinner,non-veg,"Fillet fish, oil, milk, flour, butter, salt, ground black pepper"
155,chilli fish,400,Chinese,dinner,non-veg,"For fish pieces (Boneless), Flour, Cornflour, Baking Powder, Soy Sauce, Celery, Pepper, Salt, Oil, Green Onion, Sauce:, Ginger, Garlic, Green Chili, Soy Sauce, Tomato Sauce, Chili Sauce, Cornflour"
156,fish ambultiyal,430,Indian,dinner,non-veg,"Tuna, onion, fenugreek, whole chilli, pandan leaf, salt, water, cardamom, cinnamon, coriander powder, black pepper, red chilli, curry powder, garlic (crushed), chili flakes, gorca, salt"
157,chettinad fish fry,370,Indian,dinner,non-veg,"Surmai fish, oil, garlic buds, ginger (mash), cumin, fennel, whole coriander, black pepper, mustard seeds, curry leaves, salt, oil, water, tomatoes, red pepper powder, turmeric powder, tamarind pulp, cornflour, lemon pieces of"
158,fish moilee,380,Indian,dinner,non-veg,"Basa fish, onion, ginger, garlic buds, green chillies, turmeric, red chilli powder, coriander powder, lemon juice, curry leaves, refined oil, refined oil, mustard seeds, black pepper, fennel, green cardamom, coconut milk, Cherry tomatoes"
159,batter fish,410,Mexican,dinner,non-veg,"Fresh fish pieces (river sol or sea bass), maida, passerley, oil, baking powder, maida, egg (optional), soda water, salt and pepper"
160,fish salan,420,Mexican,dinner,non-veg,"King fish, ripe tomatoes, desi ghee, ginger-garlic paste, onion, turmeric powder, red chilli powder, black pepper powder, garam masala, ginger, turmeric powder, fennel powder, refined oil, salt, water"
161,spanish fish fry,360,Mexican,dinner,non-veg,"Sol fish, tomato, onion, lemon juice, olive oil, ginger and garlic paste, bay leaves, cinnamon stick, green chillies, vinegar, salt, water"
162,prawn potato soup,280,Thai,lunch,veg,"Onion, potato, prawns, eggs, milk, butter, coriander, salt, water"
163,red rice vermicelli kheer,350,Indian,dinner,veg,"red rice vermicelli / broken sooji / semolina vermicelli, butter, almonds, whole milk, cardamom powder, saffron strands / thread, sugar"
164,green cucumber shots,200,Healthy Food,snack,veg,"english cucumbers, garlic cloves (smashed), romaine lettuce, basil, parsley, cilantro, big lemon, sea salt, olive oil"
165,thai pineapple rice,380,Thai,lunch,veg,"rice, onion, thai ginger , fresh turmeric, curry leaf, lemon grass, coconut milk, salt, hot curry powder, pineapple chunks, oil, water, turmeric powder, fresh pineapple"
166,green asparagus risotto,420,Italian,dinner,veg,"carnaroli rice, vegetable broth, butter, extra virgin olive oil, parmigiano cheese, onion (minced), white wine, salt & pepper"
167,veg fried rice,320,Chinese,lunch,veg,"oil, ginger-garlic paste, spring onion, carrot, cabbage, capsicum, salt, soy sauce, vinegar, rice"
168,egg and garlic fried rice,340,Chinese,lunch,non-veg,"oil, garlic, spring onion , ginger, red chilli , egg, cooked rice, salt, black pepper powder, soya sauce"
169,curd rice,270,Indian,dinner,veg,"rice, water, curd, milk, carrot, green chilli, ginger, salt, coriander leaves, oil, mustard seeds, chana dal, urad dal, curry leaves, red chilli, hing"
170,fried rice with soya chunks,370,Chinese,lunch,veg,"basmati rice, carrot, capsicum, beans, green peas, ginger, garlic, green chillies, bay leaf, cinnamon sticks, green cardamoms, clove, soya chunks, salt,"
171,corn pulao,380,Indian,lunch,veg,"basmati rice, american corn kernels, olive oil, onion, ginger garlic paste, salt, green chillies, cumin seed, bay leaf, pepper corn, cloves, hot water, coriander leaves, lime juice, bell pepper (saut?ed and diced), coconut"
172,zucchini methi pulao,340,Indian,lunch,veg,"zucchini, basmati rice, fenugreek (methi), clarified butter (desi ghee), clarified butter (desi ghee), cumin seeds (jeera), asafoetida (heeng), green chilles, ginger, salt"
173,lemon rice,290,Indian,lunch,veg,"cooked basmati rice, oil, asafoetida (heeng), mustard seeds (sarson), curry leaves (kadhi patta), whole red chilli (sabut laal mirch), turmeric powder(haldi), salt, lemon juice, peanuts, urad dal, chana dal, ginger"
174,kale channe ki biryani,450,Indian,lunch,veg,"black gram (kala chana), basmati rice (soaked for 2 hours), cinnamon, green cardamoms, cloves, ghee, black cardamoms, black peppercorns, bay leaves, onions, green chillies (slit), ginger-garlic paste, coriander powder, turmeric powder, yogurt, fresh mint leaves, fresh coriander leaves, garam masala powder, red chilli powder, salt, cashew nuts, almonds, milk, fresh cream, saffron, ginger, screw pine essence (kewra), browned onions, whole wheat flour dough"
175,chicken paella,490,Mexican,dinner,non-veg,"chicken, oil, salt and pepper, paprika powder, chilli flakes, garlic paste, onions, bell peppers, rice, vegetable stock, saffron, peas, olives, parsley, white wine"
176,thai fish curry,430,Thai,dinner,non-veg,"fish (cubed), thai green curry paste, oil, onions, garlic, ginger/galangal, coconut milk, coriander, lemon juice, palm sugar, basil leaves, salt & pepper"
177,vegetable pulao,340,Indian,lunch,veg,"water, basmati rice, ghee, paneer (cooked), carrot, beans, peas, elaichi, cardamoms, cinnamon, bay leaves, cumin seeds, chilli powder, turmeric, salt, coriander leaves"
178,oats shallots pulao,350,Healthy Food,lunch,veg,"Rice, Green Coriander, Green Chillies, Onion, Cinnamon, Cardamom, Cloves, Red Chilli Powder, Salt, Garlic Flakes, Ginger, Chalet, Olive Oil"
179,shiitake fried rice with water chestnuts,420,Chinese,lunch,veg,"Shitake Mushrooms, Vegetable Oil, Garlic Buds, Green Chillies, Water chestnuts, Onions, Leaks, Celery, Ginger, Sesame Oil, Rice Baked, White Chillies, Salt, Rice Wine Vinegar, Green Onions, Small Bunch Pasarley, Sesame Oil"
180,lotus leaf wrapped fried rice,390,Chinese,lunch,veg,"Jasmine Rice (Baked), Edamame Beans, Mock Meat, Shitake Mushroom, Spring Onion, Dark Soy Sauce, Sunflower Oil, Salt"
181,vegetable biryani,420,Indian,lunch,veg,"Cumin, Onion, Ginger Garlic, Mix Vegetable, Coriander Powder, Garam Masala, Turmeric Powder, Salt, Red Chilli Powder, Green Chillies, Lemon Juice, Steamed Rice, Green Coriander"
182,avial with red rice,390,Indian,lunch,veg,"Red rice, water, potatoes, carrots, raw banana, drumstick, small raw mango, sour curd, bean stick, onion, salt, turmeric, water, coconut oil, green chillies, mustard seeds (crushed)"
183,rice in lamb stock,420,Thai,lunch,non-veg,"Rice, desi ghee, big cardamom, bay leaf, cinnamon stick, fennel, onion, lamb bonz, royal cumin, cashew, cream, green cardamom powder, salt, water"
184,vegetable bruschetta,320,Italian,lunch,veg,"baguette (grilled slices), black olive tapenade, artichoke hearts, lettuce arugula (trummed), tomato confit, fresh basil leaves, mint leaves, zucchini, goat cheese, parmesan cheese shavings, mozzarella buffalo cheese"
185,red wine braised mushroom flatbread,370,Italian,dinner,veg,"olive oil, fresh buffalo mozzarella cheese, canned pelati tomatoes (cooked), pizza/flatbread base, mushrooms, red wine, parsley, garlic cloves (halved), salt"
186,strawberry & pistachio breton tart,410,Dessert,dinner,veg,"plain flour, baking powder, sea salt, unsalted butter, egg yoks, castor sugar, double cream, yolk, sugar, gelatine, butter, pistachio paste, strawberry"
187,tricolour pizza,440,Italian,dinner,veg,"pizza base , pizza sauce, mozzarella cheese, black olive, green capsicum, carrots, olive oil"
188,instant rava dosa,350,Indian,breakfast,veg,"rava/suji/semolina, rice flour, all purpose flour, fresh coconut (pieces), jeera, green chilli, dhaniya, onion (diced), salt, water, oil, ghee/clarified butter"
189,easy bread poha,270,Indian,breakfast,veg,"oil, hing, mustard seeds, curry leaves, whole red chillies, cookes peas, peanuts, turmeric powder, salt, bread, green chillies, lemon juice, coriander leaves, dessicated coconut"
190,bread chana basket,380,Indian,snack,veg,"bread (white/brown), butter, for chana chaat:, chana, onion, tomatoes, cumin seeds, ginger garlic paste, chilli powder, chana masala, turmeric powder , oil, salt"
191,spaghetti with clams & crispy bread crumbs,560,Italian,dinner,veg,"panko, 1/4 cup plus 1 tablespoon extra-virgin olive oil, plus more for drizzling, kosher salt, freshly ground pepper, garlic cloves, manila clams or cockles, scrubbed, dry white wine, spaghetti, lemon zest, lemon juice, mullet bottarga (optional; see note), red pepper, thyme, rosemary, parsley"
192,kasha bread,420,French,lunch,veg,"kasha, boiling water, buckwheat flour, all-purpose gluten free flour, brown sugar, baking powder, baking soda, xanthum gum, salt, buttermilk, cream, egg, oil, walnuts"
193,egg paratha,360,Indian,breakfast,non-veg,"whole wheat flour, salt, oil, eggs, onions, green chilli, coriander leaves, garam masala"
194,egg and cheddar cheese sandwich,280,Mexican,breakfast,non-veg,"egg, salt, pepper, ham slices, basil leaves"
195,egg in a blanket,220,French,breakfast,non-veg,"eggs, brown bread slices, butter, chilli flakes, oregano, salt"
196,bread dahi vada,320,Indian,snack,veg,"bread slices, curd, oil, salt and black pepper , red chilli powder, aamchoor powder, mint leaves, zeera powder, anardana"
197,cheese and avocado parantha,390,Mexican,breakfast,veg,"Wheat flour, Kasuri methi, water, olive oil, avocado, mozzarella cheese, pizza tasting, ghee, salt"
198,bread with tomatoes and olives,280,Italian,snack,veg,"French Bread Loaf, Tomato, Extra Virgin Olive Oil, Salt, Black Pepper, Passerley, Stuffed Green Olive"
199,lemon poppy seed cake,189,Dessert,dinner,veg,"plain flour, baking powder, salt, castor sugar, baking soda, eggs, butter, vanilla essence, lemon juice, poppy seed, lemon peel, to serve:, lemon syrup, whip cream, fresh berry"
200,chocolate kaju katli,275,Dessert,dinner,veg,"cashew nuts, sugar, water, milk chocolate or dark chocolate"
201,mix fruit laccha rabri tortilla crunch,320,Dessert,dessert,veg,"milk, sugar, cardamom powder, saffron, almonds and pistachios, grapes, apple, kiwi, orange, pomegranate, mint leaves, tortilla sheet, oil"
202,pista chocolate & mandarin,380,Dessert,dessert,veg,"Pistachios, milk, sugar, broken rice, green cardamom, white chocolate, milk, egg yolks, whipped cream, vanilla pod, mandarin, sugar, water"
203,banana and chia tea cake,240,Dessert,dessert,veg,"Banana, Castor Sugar, Flour, Oil, Milk, Eggs, Baking Soda, Flax Seeds, Almond Flakes, Chia Seeds"
204,chocolate and almond rum ball ,185,Dessert,dessert,veg,"Chocolate sponge eggless, dark chocolate, single cream, almonds, castor sugar, instant coffee powder, dark rum"
205,lemon sushi cake,290,Dessert,dessert,veg,"Vanilla pre mix, gel, oil, water, egg yolks, lemon juice, sugar, butter, white chocolate, cooking cream, milk"
206,chocolate doughnut,215,Dessert,dessert,veg,"Sugar, egg yolks, egg, butter, yeast, milk"
207,spiced almond banana jaggery cake,280,Dessert,dessert,veg,"Butter, cinnamon molasses powder, nutmeg (powdered), almonds, sugar, eggs, orange peel, banana, flour, baking soda, baking powder, salt, buttermilk, powdered cinnamon"
208,fennel scented sweet banana fritters,195,Dessert,dessert,veg,"Wheat flour, banana, jaggery, milk or water, ghee or oil"
209,camel milk cake tart,330,Dessert,dessert,veg,"Camel milk, sugar, vinegar, butter, brown sugar, maida, eggs"
210,quinoa coconut crumble custard,380,Dessert,dessert,veg,"Knoia (cooked), oats, cinnamon powder, salt, brown sugar or jaggery, nuts, coconut nuts, eggs, kinoia, coconut milk, maple syrup, vanilla extract, cinnamon powder, salt, honey"
211,lamb barley pot,480,Healthy Food,dinner,non-veg,"pot barley, onions, worcestershire sauce, chilli flakes, mustard seeds, thick mutton chunks, thick neck of lamb chops, water or stock (to cover), salt, black pepper (freshly ground)"
212,al hachi chicken,365,Indian,dinner,non-veg,"shallow fried chicken, bottle gourd (boiled and sun dried), onion, garlic, whole spices:, green cardamom, black cardamom, cinnamon sticks, turmeric, deggi mirch, fennel seeds powder, dry ginger powder, coriander powder, salt, mustard oil, desi ghee"
213,berry parfait hazelnut white chocolate sable,290,Dessert,dessert,veg,"for berry parfait:, egg yolk, caster sugar, berry puree, cream cheese, double cream, for hazelnut streusel:, ground hazelnut, flour, caster sugar, butter, for hazelnut white chocolate pressed sable:, hazelnut streusel, cocoa butter, puffed rice, clarified butter, melted white chocolate, for flexy berry:, raspberry puree, sugar, liquid glucose, pectin"
214,badam papite ke kebab with pineapple salsa,240,Indian,dinner,non-veg,"Raw papaya, raw potato, almonds, salt, asafoetida, turmeric, celery, coriander, ginger, green chillies, gram flour, green coriander, oil, pineapple, onion, green chillies, green coriander, lemon juice, salt, pepper"
215,mixed vegetable soup,120,Healthy Food,lunch,veg,"Mix vegetable (tomatoes, carrots, peas and French beans), salt, cumin powder, oil, curry leaves"
216,duo of chocolate and strawberry,175,Dessert,dessert,veg,"dark chocolate, white chocolate, strawberries"
217,mustard-parmesan whole roasted cauliflower,190,Healthy Food,dinner,veg,"cauliflowers, garlic, halved, olive oil , dijon mustard , kosher salt , freshly ground black pepper , fresh parsley leaves, parmesan , lemon wedges"
218,hassel back sweet potatoes,250,Healthy Food,dinner,veg,"sweet potatoes, butter, brown sugar, pure vanilla extract, ground cinnamon, himalayan pink salt / rock salt"
219,mother christmas cake,380,Dessert,dessert,veg,"tart apples (2 large), sugar, apple juice, eggs, vegetable oil, vanilla extracts, all-purpose flour, apple pie spice (cinnamon), salt, pecans, candied red cherries (halved), candied green cherried (halved), candied pineapple (diced), cashews (optional)"
220,matcha tea macarons,320,Dessert,dessert,veg,"egg whites, breakfast sugar, icing sugar, almond powder, matcha powder, heavy cream, white chocolate"
221,"amaranthus granola with lemon yogurt, berries and marigold",350,Healthy Food,breakfast,veg,"popped amaranthus (cholai), oats, almonds, cinnamon powder, sunflower seeds, sesame seeds, honey, brown sugar, salt, olive oil, lemon rind, plain yogurt (whipped with lemon rind), blueberries"
222,chocolate fudge cookies,200,Dessert,dessert,veg,"dark chocolate coverture, butter, sugar, eggs, flour, baking powder, salt, cocoa powder, vanilla essence"
223,veg summer rolls,180,Thai,lunch,veg,"rice paper sheets, iceberg lettuce, carrot, bean sprouts, cucumber, tofu, basil, mint leaves, coriander, rice noodles (soaked in warm water for 20-25 minutes), peanuts, hoisin sauce, peanuts, garlic, oil, red chillies, water"
224,eggless vanilla cake,250,Dessert,dessert,veg,"maida, baking powder, castor sugar, butter, milk, vanilla essence, vinegar"
225,sweet potato pie,300,Dessert,dessert,veg,"yams (red skinned), condensed milk, sugar, egg , cinnamon , marshmallows"
226,wok tossed asparagus in mild garlic sauce,120,Healthy Food,lunch,veg,"asparagus, 1 fried onion (medium), 1/2 tsp breakfast sugar, 10 ml potato starch, 20 ml stock vegetarian, 20 gm porcini, salt to taste, 50 ml oil"
227,cinnamon oatmeal pancakes,220,Healthy Food,breakfast,veg,"rolled oats, buttermilk (divided), whole wheat flour or oat flour, baking powder, baking soda, cinnamon, salt, eggs, canola oil , honey or maple syrup,"
228,chocolate chip cheesecake,350,Dessert,dessert,veg,"butter biscuits (broken into pieces), butter (softened), cream cheese (softened), sugar, egg, rose essence or vanilla essence, chocolate chips"
229,chocolate lava cake,280,Dessert,dessert,veg,"dark chocolate, butter, icing sugar, egg yolks + whole eggs, flour"
230,eggless coffee cupcakes,180,Dessert,dessert,veg,"maida/ flour, baking powder, sugar, cocoa powder, vanilla essence, butter (softened, salted. in case you are using unsalted butter, add 1/4 tsp salt), milk (to make the batter smooth. adjust the milk quantity according to your batter's smoothness), coffee powder + 1 tsp water, to make a paste (you can increase or decrease according to your coffee tolerance)"
231,chicken in white wine,300,Italian,dinner,non-veg,"black pepper, plain flour, olive or sunflower oil, rashers lean bacon, onions or shallots (cut in half), mushrooms, butter, boneless and skinless chicken breasts (chopped into 3cm pieces), dry white wine, chicken or vegetable stock, garlic cloves, bay leaves, fresh thyme sprigs (washed or 1/2 tsp dried thyme)"
232,apple and walnut cake,230,Dessert,dessert,veg,"Apple, Eggs, Walnuts, Sugar, Walnuts, Oil, Flour, Baking Powder, Cinnamon Powder"
233,gluten free almond cake,220,Healthy Food,dessert,veg,"Almond Powder, Egg, Honey, Baking Soda, Vanilla Essence, Salt, Honey, Almond"
